key,CreationDate,author,email,link,message,title
note-01,2019/08/09 10:00,"juanito12-Gomez,Juanito","juanito@gmail.com",ftp://roberto.com/book-reviews,"Esta es la primera nota.","Primera Nota"
note-02,2019/07/24 11:00,"pedro234-Gonzalez,Pedro","pedro234@hotmail.com",https://david.com/blog,"Guía para seguir metodologías en github.","Metodologías Github"
note-03,2019/05/23 15:30,"sara12-Chaparro,Sara","sara12@gmail.com",https://www.prueba.com,"Videos para mejorar el aprendizaje de los cursos","¡Videos de aprendizaje!"
note-04,2019/03/12 18:20,"lucia123-Jimenez,Lucia","lucia123@alum.us.es",https://sara.com/blog,"¿Hay clase práctica la siguiente semana?","Duda:clase practica"
note-05,2019/06/12 08:00,"PabloCf-Casal,Pablo","pablo2@gmail.com",https://www.guiaSql.com,"La mejor guía para aprender SQL desde 0","Guía #1 SQL"